
6003, 1, 0, 1, 0, 5
12, 5, 0, 0, 0, 下拜师尊，诚意致谢, (师尊飘然离去), , , , 5, 5, 3, 6003, 0, 0, 0, 5, 4, 1, 15, 0, 0, 5, 0, 0, 0, 0, 327680, 0, 0, 0, 0, 0, 5, 0, 0, 0, 0, 0, 根骨+15 首次完成奖励怒梅·喋血, , 
12, 4, 0, 0, 0, “我一定会的！”, “江湖行走，你们二人若能并肩携手，我便也放心了。这本秘笈，可以习得合击之技，我赠予你。”师尊说，“勿忘初心，方得始终。”, , , , 5, 5, 0, 0, 0, 0, 0, 5, 0, 0, 0, 0, 0, 5, 0, 0, 0, 0, 327680, 0, 0, 0, 0, 0, 5, 0, 0, 0, 0, 0, , 5, 
12, 3, 0, 0, 0, 你正想逃走，却被叫住, “在侠客岛太闷的话，就多回来走走吧。”掌门竟然好像认得你，对你十分亲切地说着。“<gender=1$$师兄><gender=0$$师姐>很照顾你，等你变强了，也要多照顾他。”, , , , 5, 5, 0, 0, 0, 0, 0, 5, 0, 0, 0, 0, 0, 5, 0, 0, 0, 0, 327680, 0, 0, 0, 0, 0, 5, 0, 0, 0, 0, 0, , 4, 
12, 2, 0, 0, 0, 你四处乱走，心情稍霁, 此时一个身影出现在面前。\n你吓得动也不敢动——居，居然是掌门！到底该怎么办才好？, , , , 5, 5, 0, 0, 0, 0, 0, 5, 0, 0, 0, 0, 0, 5, 0, 0, 0, 0, 327680, 0, 0, 0, 0, 0, 5, 0, 0, 0, 0, 0, , 3, 
12, 1, 0, 0, 0, 秘会师尊, 今日一切气氛，都有所不同。\n你不知为何，心情烦闷，竟跑回了师门，在后山无目的地转悠。, ../Imagesets/UI/SM_youli/xiayulu_tips/6000.png, , , 5, 5, 0, 0, 0, 0, 0, 5, 0, 0, 0, 0, 0, 5, 0, 0, 0, 0, 327680, 0, 0, 0, 0, 0, 5, 0, 0, 0, 0, 0, , 2, 

