
8013, 1, 0, 1, 0, 6
12, 5, 0, 0, 0, 扬声询问, 你扬声询问来者何人，却被点了穴道，眼前一片漆黑。黑暗之中只听闻来人抚琴数拍，寥寥音符之间，似有无限悲愤，令人心头窒塞。不久舒音前来将你救醒，你视力慢慢恢复，眼前却空无一人，只有琴音余韵，回荡在脑海之中。, , , , 5, 5, 3, 801301, 0, 0, 0, 5, 2, 801301, 0, 0, 0, 65541, 974454784, 12, 0, 0, 327680, 0, 0, 0, 0, 0, 5, 0, 0, 0, 0, 0, 侠誉图：琴音·悲鸣 青梅令：100, , 
12, 6, 0, 0, 1, 默不作声, 你佯装昏倒，沉默无声；待耳中来人气息略为平缓之后，方自眼缝之中偷看。来者竟是一名女子，眼含煞气，却丰姿绝美。她读信数遍之后，径直离去。不久舒音前来将你救醒，你告知先前所见，舒音大惊，表示如此形态武林中只有一人，便是本应已经死去的琴魔练清商！, , , , 5, 5, 3, 801302, 0, 0, 0, 5, 2, 801302, 0, 0, 0, 65541, 974454784, 12, 0, 0, 327680, 0, 0, 0, 0, 0, 5, 0, 0, 0, 0, 0, 侠誉图：琴音·重生 青梅令：100, , 
12, 4, 0, 0, 0, 询问飞天公主之讯息, 你去信西域好友，询问飞天公主之详情。不久后收到回信，告知飞天公主实乃讹传，契丹辽国之中，有萧太后之长女、大公主观音奴，擅以琵琶弦音操控雪色鹦鹉对敌。其琵琶之力，乃为武道，而非乐理。你欲将信中所述告知舒音，却不料忽然听闻到一声琴音，竟是周身不能动弹，信笺也被人夺走。, , , , 5, 5, 0, 0, 0, 0, 0, 5, 0, 0, 0, 0, 0, 5, 0, 0, 0, 0, 327680, 0, 0, 0, 0, 0, 5, 0, 0, 0, 0, 0, , 5$$ 6, 
12, 3, 0, 0, 0, 与舒音闲聊, 酒过三巡，舒音半醉之间，告知你，她自诩古筝、锦瑟、清歌、乐舞四艺可冠绝天下。但箫笛之道，心悦臣服于移花萧曼声；古琴之道，自然不及琴魔练清商。唯有琵琶一事，听闻西域有飞天公主，神乎其技，却未能一见，存乎疑义。, , , , 5, 5, 0, 0, 0, 0, 0, 5, 0, 0, 0, 0, 0, 5, 0, 0, 0, 0, 327680, 0, 0, 0, 0, 0, 5, 0, 0, 0, 0, 0, , 4, 
12, 2, 0, 0, 0, 前往聆音楼一行, 舒音姑娘十分欢喜你的来访，谢绝其他客人，专辟静室，为你抚琴一曲。更有侍女，呈上西域美酒，天山果干，燕云肉脯与江南香茶，熏香缭绕之间，确有无限清雅与无限惬意。, , , , 5, 5, 0, 0, 0, 0, 0, 5, 0, 0, 0, 0, 0, 5, 0, 0, 0, 0, 327680, 0, 0, 0, 0, 0, 5, 0, 0, 0, 0, 0, , 3, 
12, 1, 0, 0, 0, 世间琴音, 聆音楼开业一月以来，生意火爆。你斟酌之下，决定前往拜访舒音姑娘，看看有什么需要帮忙之处。, ../Imagesets/UI/SM_youli/xiayulu_tips/8000.png, , , 5, 5, 0, 0, 0, 0, 0, 5, 0, 0, 0, 0, 0, 5, 0, 0, 0, 0, 327680, 0, 0, 0, 0, 0, 5, 0, 0, 0, 0, 0, , 2, 

