
744, 他朋友既求虚名定引纷争，因果而已。, 1, 0, , , , , 
745, 不必气馁，若师妹有兴致，我陪你切磋。, 1, 2, , , , , 
746, 师妹不必在武学上急于求成，一步一步来。, 1, 1, , , , , 
747, 比赛年年举办，日头底下无新事。, 1, 0, , , , , 
748, 师妹聪慧，不必操之过急，切记莫忘初心。, 1, 2, , , , , 
749, 师妹加油。, 1, 1, , , , , 
750, 你是该勤加休息，莫要少年贪玩。, 1, 0, , , , , 
751, 师妹聪慧，不必操之过急，切记莫忘初心。, 1, 2, , , , , 
752, 师妹加油。, 1, 1, , , , , 
753, 你是该勤加休息，莫要少年贪玩。, 1, 0, , , , , 
754, 师妹聪慧，不必操之过急，切记莫忘初心。, 1, 2, , , , , 
755, 师妹加油。, 1, 1, , , , , 
756, 你是该勤加休息，莫要少年贪玩。, 1, 0, , , , , 
757, 师妹聪慧，不必操之过急，切记莫忘初心。, 1, 2, , , , , 
758, 师妹加油。, 1, 1, , , , , 
759, 你是该勤加休息，莫要少年贪玩。, 1, 0, , , , , 
760, 也许他是见你侠心一片，出手相助。, 1, 2, , , , , 
761, 你若心觉亏欠，不如下次与他明说。, 1, 1, , , , , 
762, 总这样？对你是不是有所图，你可小心。, 1, 0, , , , , 
763, 师妹侠行天下非靠手中剑，乃靠心中正气。, 1, 2, , , , , 
764, 是个很有思想的人，可多与他来往。, 1, 1, , , , , 
765, 掉书袋的浪荡子而已。, 1, 0, , , , , 
766, 师妹莫置气，知晓缘由朋友也不会怪责你。, 1, 2, , , , , 
767, 你与他人真心相交，本也不在这些俗物。, 1, 1, , , , , 
768, 你就是年轻气盛，好与人斗。, 1, 0, , , , , 
769, 师妹人好，到哪都交得到朋友。, 1, 2, , , , , 
770, 你得了个便宜朋友，日后行走江湖方便许多。, 1, 1, , , , , 
771, 别是别有用心接近你吧？, 1, 0, , , , , 
772, 不错，朋友之间尊重彼此想法很重要。, 1, 2, , , , , 
773, 你做的对。, 1, 1, , , , , 
774, 那你这回可是开罪绝智轩了。, 1, 0, , , , , 
775, 你是好意，他有自己的选择，不必过于介怀。, 1, 2, , , , , 
776, 或许他与你在这事上看法并不一致。, 1, 1, , , , , 
777, 你这是好心办坏事。, 1, 0, , , , , 
778, 何时都不可对非己之物，妄起贪念。, 1, 2, , , , , 
779, 肯定遭受严惩。, 1, 1, , , , , 
780, 这盐贩多半要报复与你。, 1, 0, , , , , 
781, 听你所诉当真心惊，下次我陪你去。, 1, 2, , , , , 
782, 那要多谢她了。, 1, 1, , , , , 
783, 太危险了，以后没我同意，不准出海。, 1, 0, , , , , 
784, 看来你有所收获，我替你高兴。, 1, 2, , , , , 
785, 你只要玩得开心就好。, 1, 1, , , , , 
786, 你未坚行所欲，看来意志不够坚定。, 1, 0, , , , , 
787, 如此甚好，看来你交到了个不错的朋友。, 1, 2, , , , , 
788, 那挺好的。, 1, 1, , , , , 
789, 人家跟你客气而已。, 1, 0, , , , , 
790, 师妹应该好好和师父解释，或许师父会谅解。, 1, 2, , , , , 
791, 你当时未回书信，师父也是担心你。, 1, 1, , , , , 
792, 活该。, 1, 0, , , , , 
793, 果真吗？下次我陪你再访可好？, 1, 2, , , , , 
794, 毕竟天下一大胜景。, 1, 1, , , , , 
795, 哦。, 1, 0, , , , , 
796, 果真吗？下次我陪你再访可好？, 1, 2, , , , , 
797, 毕竟天下一大胜景。, 1, 1, , , , , 
798, 哦。, 1, 0, , , , , 
799, 那下次举办，你我一起去凑个热闹。, 1, 2, , , , , 
800, 那可不是，年年八荒精英汇聚一堂热闹着呢。, 1, 1, , , , , 
801, 你勤加修习，自有参与剑荡之试的那天。, 1, 0, , , , , 
802, 兵剑有灵，大概也会祝福主人一生顺遂。, 1, 2, , , , , 
803, 师妹真是奇思妙想。, 1, 1, , , , , 
804, 瞎想些啥呢。, 1, 0, , , , , 
805, 的确丧尽天良，还好有你维护正义。, 1, 2, , , , , 
806, 做的很好。, 1, 1, , , , , 
807, 落草为寇之人能做些什么好事，大惊小怪。, 1, 0, , , , , 
808, 你冰雪聪明心地仁善，自不可同日而语。, 1, 2, , , , , 
809, 别想这么多了。, 1, 1, , , , , 
810, 什么乱七八糟的。, 1, 0, , , , , 
811, 你冰雪聪明心地仁善，自不可同日而语。, 1, 2, , , , , 
812, 别想这么多了。, 1, 1, , , , , 
813, 什么乱七八糟的。, 1, 0, , , , , 
814, 有成捕头教导，师妹心愿必将实现。, 1, 2, , , , , 
815, 希望他耳濡目染，能改过自新。, 1, 1, , , , , 
816, 会的。, 1, 0, , , , , 
817, 余毒可清？我为你把脉。, 1, 2, , , , , 
818, 那真是得多谢成捕头。, 1, 1, , , , , 
819, 是你自己不小心。, 1, 0, , , , , 
820, 师妹机敏，却不知是何人所为。, 1, 2, , , , , 
821, 你们烧毁信件，不是断了线索？, 1, 1, , , , , 
822, 多想无益，反正都烧了。, 1, 0, , , , , 
823, 但行好事，莫问前程。, 1, 2, , , , , 
824, 此话别有禅机。, 1, 1, , , , , 
825, 瞎想些啥呢。, 1, 0, , , , , 
826, 人一生若以天下为家国，总会面临很多取舍。, 1, 2, , , , , 
827, 他们内心丰满，盛满了天下离人，并不孤单。, 1, 1, , , , , 
828, 愿他们早日团聚。, 1, 0, , , , , 
829, 师妹身手厉害，贼人自然闻风丧胆。, 1, 2, , , , , 
830, 此行你辛苦了，可有受伤？, 1, 1, , , , , 
831, 你可真是初生牛犊不怕虎。, 1, 0, , , , , 
832, 师妹身手厉害，贼人自然闻风丧胆。, 1, 2, , , , , 
833, 辛苦了，洗漱一番歇息吧。, 1, 1, , , , , 
834, 没遇到还不好？, 1, 0, , , , , 
835, 好，我陪你同去。, 1, 2, , , , , 
836, 你记挂朋友之心，的确难得。, 1, 1, , , , , 
837, 人家忙着呢，少给人家添乱。, 1, 0, , , , , 
838, 师妹聪慧，什么都一点即通。, 1, 2, , , , , 
839, 可要牢记胜不骄败不馁喔！, 1, 1, , , , , 
840, 哦。, 1, 0, , , , , 
841, 难得你如此体贴细致，我必好好佩戴。, 1, 2, , , , , 
842, 做的可真精巧，多谢师妹。, 1, 1, , , , , 
843, 我辈习武之人，自有内力护体，佩之无用。, 1, 0, , , , , 
844, 此事已过不必深责，下次可知道要怎么做了？, 1, 2, , , , , 
845, 不必过责。, 1, 1, , , , , 
846, 你得了名次就好，管他人做甚。, 1, 0, , , , , 
847, 我替你高兴。, 1, 2, , , , , 
848, 挺好的。, 1, 1, , , , , 
849, 你这算多管闲事？, 1, 0, , , , , 
850, 哪里，是小师妹做事认真，凡事肯学肯想。, 1, 2, , , , , 
851, 你这小机灵鬼儿。, 1, 1, , , , , 
852, 这种话说来害臊。, 1, 0, , , , , 
853, 哪里，是小师妹做事认真，凡事肯学肯想。, 1, 2, , , , , 
854, 你这小机灵鬼儿。, 1, 1, , , , , 
855, 这种话说来害臊。, 1, 0, , , , , 
856, 没关系，若是有兴趣下次我找舒音好好教教你。, 1, 2, , , , , 
857, 真想看你出糗的样子啊！, 1, 1, , , , , 
858, 谁叫你平时不用功。, 1, 0, , , , , 
859, 诗词歌赋只为直抒胸臆，太讲平仄反落下乘。, 1, 2, , , , , 
860, 怎么会呢？你率性可爱，我很赞许。, 1, 1, , , , , 
861, 作诗的确要谨遵格律才能朗朗上口。, 1, 0, , , , , 
862, 此行玩的很高兴？我也替你高兴。, 1, 2, , , , , 
863, 是是，我的神仙小师妹。, 1, 1, , , , , 
864, 你哪是嫦娥仙子，你是贪吃兔子。, 1, 0, , , , , 
865, 我们将他们挨着放置彻夜长明，如同你我。, 1, 2, , , , , 
866, 难为你有这样的心思，这样记挂我。, 1, 1, , , , , 
867, 你怎么整天想这些有的没的。, 1, 0, , , , , 
868, 瞧你远行疲累，先好好休息。, 1, 2, , , , , 
869, 你先放入仓库。, 1, 1, , , , , 
870, 你怎么整天想这些有的没的。, 1, 0, , , , , 
871, 师妹聪慧，什么都一点即通。, 1, 2, , , , , 
872, 可要牢记胜不骄败不馁喔！, 1, 1, , , , , 
873, 哦。, 1, 0, , , , , 
874, 师妹做的，我都喜欢。, 1, 2, , , , , 
875, 嗯，滋味甚佳。, 1, 1, , , , , 
876, 我素来不贪这些零嘴，你是知道的。, 1, 0, , , , , 
877, 师妹选的，我都喜欢。, 1, 2, , , , , 
878, 嗯，都很好。, 1, 1, , , , , 
879, 你怎么尽耽误时间在这些事情上。, 1, 0, , , , , 
880, 我会一直照顾你，直到你不需要我照顾了为止。\n, 1, 2, , , , , 
881, 不要再去想这些过去的事，我会在你身边。, 1, 1, , , , , 
882, 别难过了。, 1, 0, , , , , 
883, 是，师妹就算不兑果汁也是天下第一的海量！, 1, 2, , , , , 
884, 既然尽兴，那便足矣。, 1, 1, , , , , 
885, 切不要玩心过头，待会儿还要考教你功课呢。, 1, 0, , , , , 
886, 有啊，白玉京，公子羽……都是。, 1, 2, , , , , 
887, 这个……江湖上的事，以后再跟你说吧。, 1, 1, , , , , 
888, 问这个干嘛？, 1, 0, , , , , 
889, 好呀，明日我便考校考校你的武艺, 1, 2, , , , , 
890, 加油, 1, 1, , , , , 
891, 不好好历练，又去听什么书, 1, 0, , , , , 
892, 真希望有一天，你我可以并肩战斗！, 1, 2, , , , , 
893, 那好啊，咱们俩以后可要多多练习。, 1, 1, , , , , 
894, 既然如此，还不加紧练习？, 1, 0, , , , , 
895, 太好了，这正验证了你许久以来的努力！, 1, 2, , , , , 
896, 不可骄傲，要再接再厉。, 1, 1, , , , , 
897, 要每次都拿第一才行。, 1, 0, , , , , 
898, 名次不重要，重要的是你验证了自己实力。, 1, 2, , , , , 
899, 不错的成绩！, 1, 1, , , , , 
900, 为什么没拿第一？, 1, 0, , , , , 
901, 嗯，累了吧？来歇歇吧。, 1, 2, , , , , 
902, 是不是参加比赛，没得好名次？算啦，我不问了……努力就好。, 1, 1, , , , , 
903, 哈哈哈，此地无银三百两……, 1, 0, , , , , 
904, 太好了，这正验证了你许久以来的努力！, 1, 2, , , , , 
905, 不可骄傲，要再接再厉。, 1, 1, , , , , 
906, 要每次都拿第一才行。, 1, 0, , , , , 
907, 名次不重要，重要的是你验证了自己实力。, 1, 2, , , , , 
908, 不错的成绩！, 1, 1, , , , , 
909, 为什么没拿第一？, 1, 0, , , , , 
910, 嗯，累了吧？来歇歇吧。, 1, 2, , , , , 
911, 是不是参加比赛，没得好名次？算啦，我不问了……努力就好。, 1, 1, , , , , 
912, 哈哈哈，此地无银三百两……, 1, 0, , , , , 
913, 太好了，这正验证了你许久以来的努力！, 1, 2, , , , , 
914, 不可骄傲，要再接再厉。, 1, 1, , , , , 
915, 要每次都拿第一才行。, 1, 0, , , , , 
916, 名次不重要，重要的是你验证了自己实力。, 1, 2, , , , , 
917, 不错的成绩！, 1, 1, , , , , 
918, 为什么没拿第一？, 1, 0, , , , , 
919, 嗯，累了吧？来歇歇吧。, 1, 2, , , , , 
920, 是不是参加比赛，没得好名次？算啦，我不问了……努力就好。, 1, 1, , , , , 
921, 哈哈哈，此地无银三百两……, 1, 0, , , , , 
922, 太好了，这正验证了你许久以来的努力！, 1, 2, , , , , 
923, 不可骄傲，要再接再厉。, 1, 1, , , , , 
924, 要每次都拿第一才行。, 1, 0, , , , , 
925, 名次不重要，重要的是你验证了自己实力。, 1, 2, , , , , 
926, 不错的成绩！, 1, 1, , , , , 
927, 为什么没拿第一？, 1, 0, , , , , 
928, 嗯，累了吧？来歇歇吧。, 1, 2, , , , , 
929, 是不是参加比赛，没得好名次？算啦，我不问了……努力就好。, 1, 1, , , , , 
930, 哈哈哈，此地无银三百两……, 1, 0, , , , , 
931, 太好了，这正验证了你许久以来的努力！, 1, 2, , , , , 
932, 不可骄傲，要再接再厉。, 1, 1, , , , , 
933, 要每次都拿第一才行。, 1, 0, , , , , 
934, 名次不重要，重要的是你验证了自己实力。, 1, 2, , , , , 
935, 不错的成绩！, 1, 1, , , , , 
936, 为什么没拿第一？, 1, 0, , , , , 
937, 嗯，累了吧？来歇歇吧。, 1, 2, , , , , 
938, 是不是参加比赛，没得好名次？算啦，我不问了……努力就好。, 1, 1, , , , , 
939, 哈哈哈，此地无银三百两……, 1, 0, , , , , 
